{
  "version": "v2.0.2",
  "extends": "v2.0.1",
  "count": 3,
  "services": [
    {
      "key": "runtime.command-registry",
      "owner": "uDOS-core",
      "route": "local-kernel",
      "stability": "starter",
      "consumers": ["uDOS-shell", "uHOME-client"],
      "notes": "Enumerates command namespaces and their canonical execution owner."
    },
    {
      "key": "runtime.capability-registry",
      "owner": "uDOS-core",
      "route": "local-kernel",
      "stability": "starter",
      "consumers": ["uDOS-shell", "uDOS-wizard", "uDOS-empire", "uHOME-client"],
      "notes": "Resolves stable platform capability keys to ownership and route metadata."
    },
    {
      "key": "runtime.release-lanes",
      "owner": "uDOS-core",
      "route": "promotion-manifest",
      "stability": "starter",
      "consumers": ["uDOS-dev", "uDOS-empire"],
      "notes": "Describes the version-round promotion path and release lane semantics."
    }
  ]
}
